{
  "id": "req_1234567890abcdef",
  "createdAt": "2026-08-15T00:00:00Z",
  "network": "eip155:84532",
  "asset": "0x036CbD53842c5426634e7929541eC2318f3dCF7e",
  "amountAtomic": "4454",
  "amountUsd": "0.004454",
  "model": "example",
  "pricingVersion": "conformance-v1",
  "inputTokens": 1000,
  "cachedInputTokens": 400,
  "outputTokens": 500,
  "openaiRequestId": "req_openai_example"
}
